{"schema_version":"1","report_id":"report-001","source_digests":{"intake":"sha256:aaaaaaaaaaaaaaaaaaaaaaaaaaaaaaaaaaaaaaaaaaaaaaaaaaaaaaaaaaaaaaaa","evidence":"sha256:bbbbbbbbbbbbbbbbbbbbbbbbbbbbbbbbbbbbbbbbbbbbbbbbbbbbbbbbbbbbbbbb","findings":"sha256:cccccccccccccccccccccccccccccccccccccccccccccccccccccccccccccccc"},"included_statement_ids":["obs-001"],"statement_projections":[{"statement_id":"obs-001","rendered_text":"- **obs-001** A README exists.","statement_digest":"sha256:eeeeeeeeeeeeeeeeeeeeeeeeeeeeeeeeeeeeeeeeeeeeeeeeeeeeeeeeeeeeeeee","epistemic_state":"supported"}],"sections":{"decision_context":true,"scope":true,"evidence_coverage":true,"findings":true,"unknowns":true,"recommendations":true,"review_state":true,"limitations":true},"report_digest":"sha256:dddddddddddddddddddddddddddddddddddddddddddddddddddddddddddddddd"}
